{
  "protocol_version": "telephone-line-codex-app-server-lead-recovery-v1",
  "state": "recovery_required",
  "run_id": "telephone-aaaaaaaa-bbbb-cccc-dddd-eeeeeeeeeee1",
  "run_root": "C:\\example\\state\\runs\\telephone-aaaaaaaa-bbbb-cccc-dddd-eeeeeeeeeee1",
  "thread_id": "01a02378-2617-7131-ba20-8e6d5ac625ca",
  "turn_id": "turn-2",
  "callback_write_phase": "acknowledged",
  "at_utc": "2026-08-21T00:00:00.0000000+00:00"
}
